Location,Longitude,Latitude
University of Ghana,-0.1962244,5.650562,HALL
Akuafo Hall,-0.18570339999999996,5.6504233,HALL
Volta Hall,-0.189828,5.651687,HALL
Commonwealth Hall,-0.19255780000000003,5.650778600000001,HALL
Mensah Sarbah Hall,-0.1861566,5.645423300000001,HALL
LEGON HALL ANNEX B,-0.18846429999999997,5.6469648999999995,HALL
Legon Hall Annex C (GRADUATE HOSTEL),-0.1889045,5.6473666,HALL
Legon Hall Annex A,-0.18840879999999996,5.6479501999999995,HALL
Mensah Sarbah Annex A Block,-0.1851638,5.6458409,HALL
Mensah Sarbah Annex C,-0.1853728,5.6453798,HALL
Mensah Sarbah Annex D,-0.1857564,5.645478,HALL
Akuafo Hall Annex A,-0.1855917,5.647922299999999,HALL
Akuafo Hall Annex B,-0.1856753,5.6469289,HALL
Loading... Wait a few more moments,-0.18530500000000003,5.647463300000001,HALL
Akuafo Hall Annex D,-0.1858704,5.6472017999999995,HALL
Dr. Hilla Limann Hall,-0.18488349999999998,5.637331700000001,HALL
Jean Nelson Aka Hall,-0.1884651,5.6352521,HALL
Alexander Kwapong Hall,-0.1861621,5.637268,HALL
Elizabeth Frances Sey Hall,-0.1875964,5.635961099999999,HALL
Jubilee Hall,-0.1862323,5.6403435,HALL
International Student Hostel- ISH,-0.18519879999999997,5.640027399999999,HALL
Vikings Hostel,-0.18542699999999995,5.644369099999999,HALL
GHANA HOSTELS LTD FLATS PENTAGON,-0.1814073,5.656601800000001,HALL
Bani Hostel,-0.1797826,5.6630910000000005,HALL
Evandy Hostel Legon campus,-0.18174359999999998,5.662996899999999,HALL
School of Biomedical Allied Health Sciences,5.5378508,-0.2309697,SCHOOL
University Of Ghana Dental School,5.5378459,-0.2318301,SCHOOL
West African Genetic Medicine Centre (WAGMC),5.6346248,-0.1871303,UNIVERSITY CENTRE
College Of Basic And Applied Sciences,5.6501655,-0.186234,COLLEGE
Livestock And Poultry Research Centre,Accra,5.6756561,-0.1056988,UNIVERSITY CENTRE
Forest and Horticultural Crop Research Centre,6.1438092,-0.9037471,UNIVERSITY CENTRE
School of Nuclear and Allied Sciences(SNAS),5.666415,-0.231651,SCHOOL
Department of mathematics,5.6538568,-0.1870489,DEPARTMENT
School Of Veterinary Medicine,5.6502948,-0.1853229,SCHOOL
Institute Of Applied Science & Technology,5.6530743,-0.1886049,UNIVERSITY INSTITUTE
West Africa Centre for Crop Improvement,5.6491743,-0.1867032,UNIVERSITY CENTRE
West African Centre for Cell Biology of Infectious Pathogens (WACCBIP),5.6548705,-0.192188,UNIVERSITY CENTRE
Centre for Climate Change and Sustainability Studies,5.6566119,-5.6566119,UNIVERSITY CENTRE
University of Ghana Registry,-0.1954113,5.6501606,SCHOOL REGISTRY
Great Hall,-0.1961687,5.6505784,GREAT HALL
Public Affairs Directorate,-0.195402,5.6510429,DIRECTORATE
Computer Science Department,-0.1837907,5.6544997,DEPARTMENT
Students Financial Aid Office and Students with Special Needs Office,-0.1836465,5.6479586,CENTRE
Department of English,-0.1896902,5.6503485,DEPARTMENT
International Programmes Office,-0.1820496,5.6535742,INSTITUTE
Geographic Department,-0.195635,5.6497851,DEPARTMENT
UG-CSPS School Of Social Sciences,-0.1876022,5.6549228,SCHOOL
French Department,-0.188739,5.651005,DEPARTMENT
Department Of Physics,-0.1860685,5.6514692,DEPARTMENT,
Department Of Political Science,-0.1864182,5.6546214,DEPARTMENT
DEPARTMENT OF EDUCATIONAL STUDIES AND LEADERSHIP (DESL),-0.1812233,5.6528259,DEPARTMENT
Department Of Economics,-0.1874492,5.6510632,DEPARTMENT
University of Ghana School of Law,-0.1832938,5.6542104,SCHOOL
Department of Adult Education and Human Resource Studies,-0.181138,5.6515746,DEPARTMENT
Maison Francais,-0.1876893,5.6492074,INSTITUTE
Bank Of Ghana Auditorium,,-0.1883134,5.6515081,AUDITORIUM
Legon Today,-0.180325,5.6494906,
Legon Centre for International Affairs and Diplomacy,-0.1839241,5.6521876,UNIVERSITY CENTRE
Language Center,-0.1894877,5.6498867,UNIVERSITY CENTRE
University of Ghana School of Arts,-0.1812264,5.6530512,SCHOOL
School of Pharmacy,-0.1892706,5.6539749,SCHOOL
Department of Geography and Resource Development,-0.1832581,5.6509721,DEPARTMENT
University of Ghana Guest Centre,-0.1896858,5.6449207,GUEST HOUSE
School of Social Sciences,-0.1872878,5.6550528,SCHOOL
University of Ghana Computing Systems(UGCS),-0.1881066,5.6522021,UGCS
University of Ghana Business School,-0.1775625,5.6585625,SCHOOL
Department Of Psychology,-0.1867135,5.6551242,DEPARTMENT
Department Of Economics Conference Facility (Bank of Ghana Conference Facility),-0.1883246,5.6515313,DEPARTMENT
University Basic School,-0.1879888,5.6427044,BASIC SCHOOL
Department Of Family And Consumer Science,-0.1840802,5.650273,,
Legon Hall,-0.1884151,5.6499527,,
University Of Ghana Sports Directorate,-0.1814595,5.6397227,,
"Confucius institute, University of Ghana",-0.1895396,5.6487109,,
"Ghana Post, Legon",-0.1878063,5.6508177,,
University Hospital - Legon,-0.1779637,5.6510676,,
Department of Soil Science,-0.184794,5.6503018,,
Department of Music,-0.1807597,5.6492089,,
Chemistry Department,-0.1852812,5.6527006,,
Department of Earth Science,-0.1841512,5.6509364,,
Department Of Animal Biology And Conservation Science,-0.1875349,5.6534118,,
Department of Nutrition and Food Science,-0.1888299,5.6537598,,
School of Engineering Sciences,-0.183031,5.6552787,,
School of Languages,-0.1896467,5.6490639,,
School of Public Health,-0.1826353,5.6367874,,
Department of Plant and Environmental Biology,-0.1862323,5.6538172,,
College of Humanities,-0.1820576,5.6537754,,
University of Ghana Pan-African Doctoral Academy (PADA) Building,-0.19128,5.6533077,,
School of Agriculture,-0.1837798,5.6501636,,
Kwame Nkrumah Complex (Institute of African Studies Annex),-0.181888,5.6510546,,
Department Of Philosophy and Classics,-0.1881891,5.6509936,,
Department of Agriculture Economics and Agribusiness,-0.1835599,5.6497242,,
Maison Française Legon,-0.1876909,5.6492965,,
Accra City Campus - University of Ghana,-0.2078176,5.5569585,,
Department for the Study of Religions,-0.1883512,5.650944,,
"Department of Biochemistry, Cell and Molecular Biological",-0.1895439,5.6547445,,
Economic Policy Management Programme Office,-0.1880942,5.6512672,,
"Law Auditorium, Faculty of Law, University of Ghana",-0.1829241,5.6539027,,
Department of Marine And Fisheries Sciences,-0.1884822,5.6537021,,
School of Graduate Studies,-0.1907917,5.6532353,,
Department Of Crop Science,-0.1848029,5.6501389,,
School of Nursing and Midwifery,-0.1902256,5.6535398,,
School of Education and Leadership new block,-0.1870506,5.6506394,,
Department Of Animal Science,-0.1831085,5.6499535,,
School of Information and Communication Studies,-0.1813064,5.6517435,,
Regional Institute for Population Studies (RIPS),-0.1840934,5.6545341,,
Department of mathematics,-0.184474,5.6538568,,
Colleges of Education,-0.1820301,5.6531442,,
Department of Statistics,-0.1838368,5.6538662,,
Legon,-0.1870506,5.6506394,,
College Of Basic And Applied Sciences,-0.1836591,5.6501655,,
University of Ghana Teaching Hospital,-0.1860829,5.6523215,,
"College Of Islamic Studies, Accra Ghana. Affiliated with International University Of Africa, Sudan.",-0.1647028,5.6783571,,
West African Genetic Medicine Centre (WAGMC),-0.1845554,5.6346248,,
Biotechnology Laboratory,-0.1837099,5.6489592,,
University of Ghana Gym Center,-0.1814809,5.6397371,,
INSTITUTE OF LOCAL GOVERNMENT STUDIES ACCRA MADINA,-0.1536188,5.6630415,,
INSTITUTE OF AFRICAN STUDIES,-0.1811087,5.6493191,,
School of Perfoming Arts,-0.1807597,5.6492089,,
University Of Ghana Medical Centre,-0.185922,5.6323346,,
